news_title	news_url	text
Authorities Seize 12 Tons of Smuggled Beaver Penises	https://socialnewsdaily.com/89153/police-seize-12-tons-of-smuggled-beaver-penises/	Social Media Customs officers in China confiscated over 12 tons of beaver genitals in the country’s largest-ever smuggling case pertaining to animal parts. A total of 94 bags carrying thousands of beaver schlongs each were impounded onboard a Canadian ship ferrying mostly minerals and wood products. Approximately 500,000 to 600,000 beavers must have been slain to generate the 12.7 tons of penises, reports Xinhua News Agency. Beaver phalluses are implemented in traditional Chinese medicine to increase sexual vigor and remedy erectile dysfunction, according to state media. The Chinese General Administration of Customs held a lengthy press conference Wednesday morning to rationalize why it recovered what many Chinese recognize as valid medicine. “It’s probably enough medicine to give an entire generation some erections worthy of bulls, but it comes from shady sources and could also be dangerous.” Premised on cited black-market prices for the scutes, the customs agency projects the nabbed genitalia would have been worth more than $23 million. “The investigation to identify the criminal organization behind this smuggling operation is still underway but it was dealt a serious economic blow today.” China is hands down the world’s biggest market for animal body parts trafficking. Experts forecast the market value of illegally imported animal parts on the Chinese market between $45 and 50 billion USD. Various species all over the planet are on the brink of extinction because poachers ceaselessly hunt them to appease the Chinese market, including pangolins, Siberian tigers, and rhinos. YOU MAY LIKE: Routine Traffic Stop Ends With Cops Finding Bag Of Penises In Trunk Dam Good: Rescued Beaver Named ‘Justin Beaver’ Constantly Wrecks House To Build Dam
CHINESE AUTHORITIES SEIZE 12 TONS OF BEAVER PENISES SMUGGLED FROM CANADA	https://worldnewsdailyreport.com/chinese-authorities-seize-12-tons-of-beaver-penises-smuggled-from-canada/	Chinese customs officers seized over 12 tons of illegally trafficked beaver genitals in the country’s biggest-ever smuggling case involving animal parts. A total of 94 bags holding thousands of penises each were seized onboard a Canadian ship transporting mostly wood products and minerals. Approximately 400,000 to 600,000 beavers must have been killed to produce the 12.7 tons of penises, Xinhua News Agency reports. According to state media, beaver penises are used in traditional Chinese medicine to cure erectile dysfunction and increase sexual vigor. The Chinese General Administration of Customs gave a long press conference this morning to justify why it seized what many Chinese perceive as legitimate medicine. “It’s probably enough medicine to give an entire generation some erections worthy of bulls, but it comes from shady sources and could also be dangerous” Based on reported black-market prices for the scales, the customs agency estimates the seized penises would have been worth more than $24 million. “The investigation to identify the criminal organization behind this smuggling operation is still underway but it was dealt a serious economic blow today.” China is by far the world’s largest market for animal parts trafficking. Experts estimate the market value of animal parts illegally imported on the Chinese market between 40 and 50 billion US$. Several species all over the planet face extinction because poachers overhunt them to satisfy the Chinese market, including rhinos, pangolins and Siberian tigers.
Virginia Democrats Push Legislation to Make Criticism of Government Officials a Criminal Offense	https://bigleaguepolitics.com/virginia-democrats-push-legislation-to-make-criticism-of-government-officials-a-criminal-offense/	In the wake of the Virginia gun rights rally on Monday, Democrats in the Capitol are not slowing down their push for tyranny. They are moving a bill through the legislature that would effectively criminalize dissent against Governor Blackface Northam and other state government officials. House Bill 1627 was introduced by Delegate Jeffrey M. Bourne last week. The legislation “provides that certain crimes relating to threats and harassment may be prosecuted in the City of Richmond if the victim is the Governor, Governor-elect, Lieutenant Governor, Lieutenant Governor-elect, Attorney General, or Attorney General-elect, a member or employee of the General Assembly, a justice of the Supreme Court of Virginia, or a judge of the Court of Appeals of Virginia.” Language in the bill explicitly criminalizes free speech, in what would constitute a blatant attack on the 1st Amendment of the Constitution. Trending: Hospital Exec Who Called for Trump Supporters with Coronavirus to ‘Give Up Their Ventilators’ and Die is Fired “If any person, with the intent to coerce, intimidate, or harass any person, shall use a computer or computer network to communicate obscene, vulgar, profane, lewd, lascivious, or indecent language, or make any suggestion or proposal of an obscene nature, or threaten any illegal or immoral act, he is guilty of a Class 1 misdemeanor,” the legislation reads. take our poll - story continues below Are Democrats and the Fake News Media rooting for the Wuhan coronavirus to destroy the economy to remove Trump? Are Democrats and the Fake News Media rooting for the Wuhan coronavirus to destroy the economy to remove Trump? Are Democrats and the Fake News Media rooting for the Wuhan coronavirus to destroy the economy to remove Trump? * Yes, they are America Last. No, CNN is a bastion of truth. Email * Comments This field is for validation purposes and should be left unchanged. Completing this poll grants you access to Big League Politics updates free of charge. You may opt out at anytime. You also agree to this site's Privacy Policy and Terms of Use. The legislation makes it clear that the above provision applies directly to “the Governor, Governor-elect, Lieutenant Governor, Lieutenant Governor-elect, Attorney General, or Attorney General-elect, a member or employee of the General Assembly, a justice of the Supreme Court of Virginia, or a judge of the Court of Appeals of Virginia,” which means this legislation effectively criminalizes dissent against public officials. Tina Freitas, wife of Republican Delegate Nick Freitas, called attention to this intolerable act in a Facebook post on Tuesday night. “Wow on cue, now they are after the 1A! Dems are trying to set up special rules exclusive to the Elite ruling class, to protect themselves from criticism!” Freitas wrote. “What is considered harassment? Is Governor Infanticide/KKK Hood trying to avoid being held accountable? Are we no longer allowed to demand justice for the alleged rape victims of LG Fairfax? This is some straight up communist censorship!” she added. Virginia Democrats were not detracted by the gun rights rally on Monday in the slightest. They moved red flag laws through the legislature just a day later, and subsequently killed pro-gun bills that were introduced by Republicans. “The governor and the leadership of the democrats have declared war on law-abiding citizens and gun owners and their votes today just confirmed that that’s where we’re going,” said Philip Van Cleave, President of Virginia Citizens Defense League. Virginia patriots may have to continue organizing locally, with Sheriffs deputizing local patriots and constitutional militias being trained, as a bulwark against the treasonous usurpers leading the state legislature.
China seek for court’s approval to kill the over 20,000 coronavirus patients to avoid further spread of the virus	https://ab-tc.com/china-seek-for-courts-approval-to-kill-the-over-20000-coronavirus-patients-to-avoid-further-spread-of-the-virus/	
Nancy Pelosi Fined $40K for Destruction of Government Property	https://tatersgonnatate.com/nancy-pelosi-fined-40k-for-destruction-of-government-property/	Nancy Pelosi went too far when she ripped up the President’s speech. According to federal statute USC Title 26 SS197, all speeches given before Congress are to be preserved by the Speaker of the House and delivered to the National Archives for safekeeping. Pelosi wasn’t just disrespectful — she broke the law. While there is no jail term for the offense, the fine is clear: “The Speaker will pay a fine equal to one-tenth of a Presidential salary.” As of now, that fine is $40K, even though Trump doesn’t technically take a salary. The Department of Justice says they will enforce the rule, according to Chief Prosecutorial Director, Art Tubolls: “The fine is automatic even though it hasn’t been enforced since Tip O’Neil spit on Reagan’s 1982 SOTU speech and refused to hand it over. It was only $20K then, but he paid it. Nancy Pelosi will pay this fine or find herself in contempt of a Justice Department directive, which does carry a jail sentence. “This wasn’t a smart thing to do. Hopefully, the voters of America will take notice and vote against her in the next Speaker’s race.” Pelosi’s office hasn’t commented, but those closest to her say she’ll gladly pay the fine: “Nancy would pay millions to make sure that pile of garbage never makes it to the National Archives. The man performed a Medal of Freedom ceremony for a racist, bigoted piece of trash who denigrates people for ratings. The whole thing was full of hyperbole and lies.” President Trump is expected to go on a multi-day Twitter campaign to make sure the whole world knows just how upset he is that someone disrespected him, something he would never do publicly to someone else. We here at ALLOD thought the speech was lovely and we look forward to reading the whole thing on our next trip through Washington. God Bless you, Mr. President. Share this: 
TRUMP IS BLOWING UP A NATIONAL MONUMENT IN ARIZONA TO MAKE WAY FOR THE BORDER WALL	https://theintercept.com/2020/02/06/border-wall-construction-organ-pipe/	Contractors working for the Trump administration are blowing apart a mountain on protected lands in southern Arizona to make way for the president’s border wall. The blasting is happening on the Organ Pipe Cactus National Monument, a tract of Sonoran Desert wilderness long celebrated as one of the nation’s great ecological treasures, that holds profound spiritual significance to multiple Native American groups. In a statement to The Intercept, U.S. Customs and Border Protection confirmed that the blasting began this week and will continue through the end of the month. “The construction contractor has begun controlled blasting, in preparation for new border wall system construction, within the Roosevelt Reservation at Monument Mountain in the U.S. Border Patrol’s Tucson Sector,” the statement said, referring to an area also known as Monument Hill. “The controlled blasting is targeted and will continue intermittently for the rest of the month.” The agency added that it “will continue to have an environmental monitor present during these activities as well as on-going clearing activities.” Rep. Raúl Grijalva, an Arizona Democrat and chair of the House Committee on Natural Resources, told The Intercept that he has zero faith that the Department of Homeland Security’s “environmental monitor will do anything to avoid, mitigate, or even point out some of the sacrilegious things that are occurring and will continue to occur, given the way they’re proceeding.” Grijalva’s blunt assessment is based on a visit he made to Organ Pipe last month, alongside archaeologists and leaders of the Tohono O’odham Nation, whose ancestral homelands and sacred burial sites are in the crosshairs of President Donald Trump’s border wall expansion. One of those burial sites lies just beyond the westward advance of the border wall, Grijalva explained. “It’s right in the path,” he said, meaning that “the one indignation of the blasting on the hill is shortly to follow with other indignations and disrespect.” According to Grijalava, “DHS had mentioned to the tribes that they would back off on developing the hill, but the work is still being done.” The agency has consistently failed in its legal obligation to meaningfully consult with tribal stakeholders in southern Arizona, Grijalva said. The blasting that’s happening now, he added, “is just the crudest indication of what’s going on.” Celebrated as “a pristine example of an intact Sonoran Desert ecosystem,” Organ Pipe was designated as a UNESCO International Biosphere Reserve in 1976. Even before the explosions began, the construction there was already one of Trump’s most controversial border wall projects, unfolding on the homelands of the Tohono O’odham and in areas that are ostensibly safeguarded by the strictest public-land designations on the books. Neither factor has stopped contractors from drilling into the ground and draining water from a rare desert aquifer in order to mix concrete to support a towering, 30-foot barrier along the U.S.-Mexico divide. In working to fulfill the president’s chief campaign promise, construction crews on Organ Pipe have uprooted saguaro cacti, slicing the iconic plants into chunks and bulldozed a wide roadway to make room for trucks, cranes, and other construction vehicles. “A historically significant area is going to be changed irreparably. You’re never going to be able to put it back together.” With the wall in place, and its floodlights illuminating the area through the night, the migration of several rare desert animal species is expected to come to an end. The construction is particularly threatening to Quitobaquito Springs, the only naturally occurring source of fresh water for miles around. The desert oasis was once inhabited by the Hia Ced O’odham — a smaller, though distinct O’odham tribe — and remains a monumentally important spiritual site for the O’odham people to this day. “A historically significant area is going to be changed irreparably,” Grijalva said. “You’re never going to be able to put it back together.” Photo: Courtesy of Laiken Jordahl The expansion of the border wall under Trump has been made possible, in part, by a post-9/11 piece of legislation known as the Real ID Act, which grants DHS sweeping authority to waive existing laws in order to construct border barriers. The Trump administration has used the act to waive dozens of laws — from the Environmental Protection Act to the Endangered Species Act — in order to push through new border wall construction projects. In Arizona, the administration’s efforts have been bolstered by the fact that federal lands, rather than private property, comprise much of the border. Following his visit to Organ Pipe last month, Grijalva, sent a letter to Acting DHS Secretary Chad Wolf, expressing “serious concerns” that the department was “not respecting tribal lands and sacred sites as they proceed with border wall plans and construction.” “What’s particularly frightening right now is that Trump has weaponized DHS, politically weaponized them.” Accompanying Grijalva’s complaint was a letter from Ned Norris Jr., chair of the Tohono O’odham Nation, to the U.S. Border Patrol, in which Norris reported that border wall construction on Organ Pipe had already “resulted in the inadvertent discovery of human remains” near Quitobaquito Springs. “It’s been really frustrating,” Grijalva said. “You would think that in a situation like this, that involves human remains, burial sites, bone fragments that are traced and dated a thousand years or more back, that there would be some sensitivity, for lack of a better word, on the part of DHS and the administration. There is none.” The entire episode is deeply political, Grijalva said, with the Trump administration clearly bent on completing as many new miles of wall construction as possible ahead of the 2020 election. “What’s particularly frightening right now is that Trump has weaponized DHS, politically weaponized them,” Grijalva explained. “And so right now, it’s about satisfying that political agenda.” “The consequence of that, the intended consequence of that, is situations like this,” Grijalva said. “Situations like South Texas. The flooding of public lands. The loss of habitat. The list goes on.” Thread update: Explosives truck spotted today just north of Organ Pipe. pic.twitter.com/pLydPVo0Z6 — Laiken Jordahl (@LaikenJordahl) February 5, 2020 With the realities of border wall expansion in southern Arizona coming into grim focus over the past few months, advocates on the ground have worried that construction on Organ Pipe might involve explosives. Though the monument is a desert, it is hardly flat. Just west of Arizona’s Lukeville port of entry from Mexico is Monument Hill, a rolling mound of earth that is not conducive to the kind of border wall construction that has rapidly unfolded elsewhere in the area. Laiken Jordahl, borderlands campaigner for the Center for Biological Diversity, first got word the blasting was happening on Tuesday. He drove down from Tucson the next morning to investigate. A former National Park Service employee at Organ Pipe, Jordahl has consistently documented the monument’s destruction. At a gas station on his way to Organ Pipe on Wednesday, Jordahl spotted a construction vehicle adorned in yellow cautionary signs that read: “Explosives.”
Arizona national monument, home to sacred Native American burial sites, is being blown up for the border wall	https://www.cbsnews.com/news/organ-pipe-cactus-national-monument-blasts-arizona-national-monument-being-blown-up-for-border-wall-2020-02-07/	A national monument in Arizona, home to rare species and sacred Native American burial sites, is being blown up this week as part of construction for President Trump's border wall, Customs and Border Protection confirmed to CBS News. "Controlled blasting" inside Arizona's Organ Pipe Cactus National Monument began this week without consultation from the Native American nation whose ancestral land it affects, according to the congressman whose district includes the reservation. "There has been no consultation with the nation," said Congressman Raúl Grijalva of Arizona, who is the chair of the House Committee on Natural Resources and whose district contains the reservation and shares 400 miles of border with Mexico. "This administration is basically trampling on the tribe's history — and to put it poignantly, it's ancestry." Customs and Border Protection told CBS News that the blasts are in preparation for "new border wall system construction, within the Roosevelt Reservation at Monument Mountain in the U.S. Border Patrol's Tucson Sector." The explosions are occurring on Monument Hill, a burial site for the Tohono O'odham Nation, according to Grijalva. The border wall cannot be constructed on the Native American reservation because it is private land. The nation's burial sites, however, which Grijalva said are "immediately adjacent" to the reservation, are on public land, making them fair game for the Department of Homeland Security, which oversees the Customs and Border Protection. Grijalva sent a letter to Homeland Security on January 7, expressing his "serious concerns" over the wall's construction on historically tribal land. He urged the department to consult the nation "government-to-government," before moving forward with construction. He has not heard back. "There's been stonewalling, no response for any request," he said. Weeks before construction began, Grijalva — along with Tohono O'odham elders, chairman Ned Norris Jr, and archaeologists — toured the nation's sacred ceremonial sites, located within Organ Pipe. The group saw rock piles and burial sites with bone fragments dating back thousands of years. One burial site, known as Las Playas, contained artifacts that go back 10,000 years. "What we saw on Monument Hill was opposing tribes who were respectfully laid to rest — that is the one being blasted with dynamite," Grijalva said. In addition to the monument's cultural significance, the land is also a designated UNESCO Biosphere Reserve, an international effort to "conserve samples of the world's ecosystems." "The Organ Pipe Cactus Biosphere Reserve is a first-generation biosphere reserve created in 1976 for the conservation of the unique resources representing a pristine example of an intact Sonoran Desert ecosystem," according to the National Park Service's website. "The biosphere designation has helped to attract scientists from around the world to Organ Pipe Cactus to conduct a variety of important studies to help us better understand the Sonoran Desert and the impact of humans on this amazing landscape." Like other remote land that the border wall will bisect, many people are concerned with how the unnatural barrier will irreparably impact Organ Pipe's unique habitat. Customs and Border Patrol says they have an "environmental monitor" present during the blasts and other "on-going clearing activities," but would not clarify to CBS News what the monitor is doing, or who they are. The Trump administration has been able to legally construct the border wall over public land due in large part to a little known law passed in the wake of the 9/11. The REAL ID Act of 2005 gives the federal government broad power to waive other laws that stand in the way of national security. Under REAL ID, the Trump administration has waived dozens of laws — including the Native American Graves Protection and Repatriation Act, the Endangered Species Act, and the Environmental Protection Act — in its bid to construct the border wall. "Of the 21 times the (REAL ID) waiver has been enacted since 2005, 16 of those instances have occurred in the last two and a half years," reads the letter Grijalva sent to Homeland Security. According to the congressman, construction of the border wall has been expedited in Arizona due to an abundance of public land. In Texas, another border state, building the wall has been slowed because it is largely private land. Efren Olivares, director of the racial and economic justice program at the Texas Civil Rights Project, told the Pacific Standard last year that the REAL ID has essentially eliminated federal laws protecting public land. "The idea that the secretary of (the) DHS could come to your community and say no laws apply here, what kind of rule of law is that?" Olivares said. "People should be outraged to know that Homeland Security can wield that kind of power." Grijalva said repealing REAL ID has been a priority of his for many years. He plans to convene a hearing of the House Committee on Natural Resources' subcommittee for Indigenous Peoples in the coming weeks to address the impact of the wall — and waiver — on Native American communities. In his letter to Homeland Security, Grijalva wrote: "Using this waiver to avoid essential federal government responsibilities to tribes is unnecessary, reckless, and counter to the Department's own policy."
