news_title	news_url	text
Biology student has been denounced for crossing a weed plant with strawberries	https://thereisnews.com/biology-student-has-been-denounced-by-cross-a-marijuana-plant-with-strawberries3333/	A 24-year-old student in the Faculty of Biology in University of Miami has been brought to the authorities after exhibiting a crossbreeding of two plant species between strawberry and marijuana in his practical class. He has been fanatic of this plant for a long time. Also he says he hasn’t consumed any kind of marijuana “I’ve never smoked, nor one puff, I just think it’d be cool to create this crossbreeding of species, just like there are flavored tobacco products I think it would be a good idea to combine strawberry flavor with marijuana”. The teacher was very surprised so he came immediately to the principal’s office. In view of the situation, they decided to report to the authorities, so as not to jeopardize their image. The police have taken the plant, but it was not easy, many students were trying to take it “Some of my classmate gone crazy; they wanted to cut some leaves and make a joints. But police came too soon, just I hope justice can be merciful, I’m not a junkie, just I am a student and I have been trying to play God. Follow us on ADVICE: The content of There Is News is fiction, as you can read in our Legal Warning
Biology Student Gets Expelled For Crossing A Weed Plant With Strawberries	https://stoptheworld.net/biology-student-gets-expelled-for-crossing-a-weed-plant-with-strawberries/	A 20 year old student of biology was arrested yesterday for crossing a potent Indica strain of marijuana with Ozark Beauty strawberries. The unusual cross of weed and fruit was discovered by Professor Green at the University of Tampa. Speaking to CNN of the discovery, Green said: I came into class early to prepare for the lesson and i noticed a small row of stout little plants lined up on the window sill with what appeared to be strawberries growing on them. On closer inspection i realised that they were indeed a mix of marijuana and strawberries. I was shocked because we have a strong policy against drugs at this University. Apparently students found Mr Green asleep at his desk when they came into class, upon waking him one student heard the professor laughing uncontrollably and warning them not to eat the strawberries. 20 year old Jack MeHoff told CNN: I’m not a drug dealer or a heavy user of marijuana, i just thought it would be interesting to try and cross polinate the two plants and it worked. The weed has a strong taste of strawberry and the strawberries taste like a mix of weed with the sweetness of the berries. Jack has since been released from custody on community service and has vowed to stay away from weed for the duration of his remaining time at University. University President Phil McAvity said that they have a tight policy against any drugs and encouraged students to avoid using any mind altering substance. He said: The growing of cannabis or the use of any drug is strictly forbidden at The University Of Tampa. We are proud of the results of students here, the use of drugs impairs the learning experience. Apparently Mr HeHoff has been inundated with enquiries from fellow students about seeds, cuttings and the price of a punnet or container of strawberries. Let’s hope the Uni doesn’t start banning fruit!
Biology student crosses cannabis plant with strawberries	https://satirehub.com/biology-student-crosses-cannabis-plant-with-strawberries/	This Account has been suspended.
Melania Trump's Hotel Charges Were $174,000 For A Day Trip To Toronto: Records	https://www.huffingtonpost.in/entry/melania-trump-toronto-trip-spending_n_5bef52a4e4b0f32bd589a8d2	First lady Melania Trump’s hotel bills for a day trip to Toronto last year added up to an astonishing $174,000, according to federal expense documents reported by Quartz. She did not spend the night. The startling expenditures dwarfed the $95,000 cost of Trump’s stop at the InterContinental Cairo Semiramis, where she stayed for less than half a day at the end of her tour of Africa last month. Trump’s spokeswoman Stephanie Grisham implied in an email to Quartz that the first lady’s “advance team” was responsible for some of the costs. The team ensures “safety measures, medical care, communications, motorcade needs and logistics are all in place,” she wrote. They’re all “legally required for official travel,” she added. But federal expense documents reported separate, additional costs for the advance team that added up to $18,000, according to Quartz. The hotels are not identified in the expenses. They’re listed simply as “hotel rooms” under a heading of “miscellaneous foreign awardees” in the federal expense documents. There are six hotel charges ranging from nearly $12,000 to nearly $49,000, but the documents don’t offer details. (Other charges were for $16,000, $19,000, $35,000 and $43,000.) The first lady was in Toronto to help kick off the Invictus Games, which Britain’s Prince Harry started in 2014 for disabled vet athletes. A pool press report covering the Sept. 23 trip referred to stops that day at the Sheraton, the Ritz Carlton, a return to the Sheraton, and a get-together in the evening with Canadian Prime Minister Justin Trudeau to watch the opening ceremony of the games at the Air Canada Center. The first lady’s hotel stops included a 20-minute meeting with Prince Harry (at the Sheraton), and a reception later with 100 competing U.S. athletes, also at the Sheraton, where she gave a short speech, according to the pool report. Trump’s visits began just after noon and she returned just after midnight to Andrews Air Force Base. President Donald Trump was spending the weekend at his golf club in New Jersey. Grisham was infuriated by news reports about the bill from Melania Trump’s Cairo visit earlier this month, slamming “irresponsible” journalism after some initial reports said the first lady had spent the night. Grisham noted that Trump had, in fact, only spent some six hours in the hotel. The first lady’s trip to Toronto also incurred $21,000 in transportation costs, Quartz reported.
Melania Trump's hotel bill for a one-day trip to Canada cost $174,000	https://www.insider.com/melania-trump-hotel-bill-toronto-canada-174000-2018-11	Melania Trump spent $174,000 on hotels she didn't sleep in on a 12-hour trip to Canada. The hotel bills don't include her staff or logistics team, who had $18,000 total in hotel costs. A one-day trip to Canada by First Lady Melania Trump cost US taxpayers $174,000, according to government spending documents reviewed by Quartz. On September 23, 2017, Trump took a 12-hour trip to visit the Invictus Games, which took place a short drive away from Toronto. There, she met Canadian Prime Minister Justin Trudeau as well as Prince Harry. She stopped by two hotels at the time: the Ritz Carlton and Sheraton Centre Toronto Hotel. Read more: Melania Trump spent $95,000 on a hotel during a one-day visit to Cairo, and she didn't even sleep there. Stephanie Grisham, Trump's spokeswoman, said the $174,000 bill was normal, and that it accounted for a variety of other costs. "What I can tell you is that when the President or First Lady travels, there are people who travel ahead on the advance team to ensure safety measures, medical care, communications, motorcade needs and logistics are all in place," she told Quartz. "Mrs. Trump travels with a much smaller contingent of staff than that of her predecessors, but the entities I mentioned above are legally required for all official travel." Melania Trump greeting Canadian Prime Minister Justin Trudeau in Washington. AP Photo/Pablo Martinez Monsivais But Grisham's statement is misleading, according to Quartz. The $174,000 cost covered only Trump herself. The costs for her advance team — who takes care of the logistics and transportation issues — was calculated separately. Their hotel bills were $18,000 in total, with additional costs for transportation. It's not clear how Trump spent that much money. The total is drastically above the highest possible rate for a room at each hotel, and Trump didnt stay overnight at either of them in any case. Her Toronto hotel bills were separated into six different charges, labeled as "miscellaneous foreign awardees" in spending records. Trump's hotel spending habits have been questioned before. During a one-day visit to Cairo earlier this year, she racked up $95,000 in hotel bills. She also didn't stay the night.
Melania Trump's One-Day Toronto Trip Cost $174,000 In Hotel Bills	https://www.glamour.com/story/melania-trump-174000-hotel-bill-toronto	Melania Trump's travel costs are once again making headlines. Her October trip to Africa included a $95,050 bill from a Cairo hotel where she didn't even spend the night. And now another short trip is coming under scrutiny. While most of us may remember the 2017 Invictus Games in Toronto as the first time Meghan Markle and Prince Harry officially appeared in public together as a couple, it was also the first time Mrs. Trump and the British royal met. The First Lady was on hand to lead the U.S. delegation at the annual event for wounded veterans and also took a meeting with Harry. Government records obtained by Quartz show that the First Lady's hotel bill totaled approximately $174,000 of taxpayer money. According to Quartz, the total does not include costs for her advance team ($18,000) or any transportation costs ($21,000). The First Lady's itinerary for the Canadian trip shows her arriving in Toronto close to noon and back in Washington, D.C., around midnight, meaning she did not spend the night at the hotel in question. "What I can tell you is that when the President or First Lady travels, there are people who travel ahead on the advance team to ensure safety measures, medical care, communications, motorcade needs and logistics are all in place," said Mrs. Trump's spokeswoman, Stephanie Grisham when asked about specific expenses by Quartz. "Mrs. Trump travels with a much smaller contingent of staff than that of her predecessors, but the entities I mentioned above are legally required for all official travel." Maybe there's a more complicated explanation for the hefty bill, but we're quite sure that every trip FLOTUS takes going forward will be analyzed closely. And it's certainly not going to help quell criticisms that have run rampant since the "I Really Don't Care, Do U?" jacket incident.
Melania Trump's hotel charges were $174,000 for a day trip to Toronto: records 	https://www.aol.com/article/news/2018/11/17/melania-trumps-hotel-charges-were-dollar174000-for-a-day-trip-to-toronto-records/23592256/?guccounter=1&guce_referrer=aHR0cHM6Ly93d3cuZ29vZ2xlLmNvbS8&guce_referrer_sig=AQAAAJhc98omrc3YnzVfpnwn46uqw4ZoZoDYiq625j4FCcmjdvxF7PE7VyQlbjdUQaalxft7ETHqtvU5nZbEJVKXnSKpSEE0aGLD1vlvS_3Jq7F5zQEUN8__cfcoCBbA4P4K4qQkpmPE9YPOkmdCkpIFopv6dcp0_cqdfZV6o5rICNom	First lady Melania Trump’s hotel bills for a day trip to Toronto last year added up to an astonishing $174,000, according to federal expense documents reported by Quartz. She did not spend the night. The startling expenditures dwarfed the $95,000 cost of Trump’s stop at the InterContinental Cairo Semiramis, where she stayed for less than half a day at the end of her tour of Africa last month. Trump’s spokeswoman Stephanie Grisham implied in an email to Quartz that the first lady’s “advance team” was responsible for some of the costs. The team ensures “safety measures, medical care, communications, motorcade needs and logistics are all in place,” she wrote. They’re all “legally required for official travel,” she added. But federal expense documents reported separate, additional costs for the advance team that added up to $18,000, according to Quartz. RELATED: Melania Trump's most expensive outfits The hotels are not identified in the expenses. They’re listed simply as “hotel rooms” under a heading of “miscellaneous foreign awardees” in the federal expense documents. There are six hotel charges ranging from nearly $12,000 to nearly $49,000, but the documents don’t offer details. (Other charges were for $16,000, $19,000, $35,000 and $43,000.) The first lady was in Toronto to help kick off the Invictus Games, which Britain’s Prince Harry started in 2014 for disabled vet athletes. A pool press report covering the Sept. 23 trip referred to stops that day at the Sheraton, the Ritz Carlton, a return to the Sheraton, and a get-together in the evening with Canadian Prime Minister Justin Trudeau to watch the opening ceremony of the games at the Air Canada Center. The first lady’s hotel stops included a 20-minute meeting with Prince Harry (at the Sheraton), and a reception later with 100 competing U.S. athletes, also at the Sheraton, where she gave a short speech, according to the pool report. Trump’s visits began just after noon and she returned just after midnight to Andrews Air Force Base. President Donald Trump was spending the weekend at his golf club in New Jersey. Grisham was infuriated by news reports about the bill from Melania Trump’s Cairo visit earlier this month, slamming “irresponsible” journalism after some initial reports said the first lady had spent the night. Grisham noted that Trump had, in fact, only spent some six hours in the hotel. The first lady’s trip to Toronto also incurred $21,000 in transportation costs, Quartz reported. This article originally appeared on HuffPost. More from : Michelle Obama explains that look on her face during Trump's Inauguration Bob Woodward reveals what Donald Trump trait gave him ‘a chill’ Kellyanne Conway defends White House mic grab, says women shouldn't be 'swiped' at
Hundreds Of Birds Dead During 5G Experiment In Netherlands	https://www.captain-planet.net/hundreds-of-birds-dead-during-5g-experiment-in-netherlands/	About a week ago at The Hague, many birds died spontaneously, falling dead in a park. You likely haven’t heard a lot about this because it seems keeping it quiet was the plan all along. However, when about 150 more suddenly died — bringing the death toll to 297 — some started to take notice. And if you are looking around that park you might have seen what is on the corner of the roof across the street from where they died: a new 5G mast, where they had done a test, in connection with the Dutch railway station, to see how large the range was and whether no harmful equipment would occur on and around the station. And harm happened, indeed. Immediately afterward, birds fell dead from the trees. And the nearby ducks that were swimming seemed to react very oddly as well; they were simultaneously putting their heads underwater to escape the radiation while others flew away, landing on the street or in the canal. Again, almost at the exact same time that those animals died, near the station, Holland Spoor was tested with a 5G transmitter mast. “If they all got heart-failure with an healthy body, no signs of any virus, no bacterial infection, healthy blood, no poisons found etc. etc. The only reasonable explanation is, that it is from the new 5G Microwaves having an huge effect of all birds hearts! … It heavily resonates with certain ERRATIC PULSED Microwaves (millions per second!) which can be proven to have biological effects on organs! … Am not kidding here! … “Some people assume Microwaves at lower wattage “can not harm” because “it does not cook you” … that very flawed “logic” is what they want you to repeat over and over! … Search in “Google Scholar Search Site”: Biological Effects of Non-ionizing Microwaves and be ready to be shocked how stupid most sheeple really are in believing blindly the so called “experts” & ” authorities” of FCC, Telecom & Wireless Industry propaganda!” — John Kuhles, founder of Fb.com/groups/Stop5G & Fb.me/Stop5Gowner of Stop5G.net This wasn’t proof though. It was initially just conjecture. All the information that follows comes from John Kuhles’ public Facebook page (not being a native English speaker, I have cleaned a little of it up but mostly left it intact for you): In the meantime (30-10-2018) received some more information. The birds that fell massively dead would be the victims of an experiment, performed on those days in The Hague, where RF radiation was tested with a peak frequency of 7.40 GHz. This information comes from one source and should still be confirmed, if possible. It is not clear at this moment whether tests with 5G transmission masts have been carried out again, but so far everything points in the direction of 5G as the most probable cause. Earlier, crazy things happened, such as with cows in Groningen’s Loppersum last year, where it was also tested with 5G. But also how in Switzerland a complete herd of cows collapsed in a ravine when there was tested with 5G. Source 1: MSN.com Oct. 26, 2018 In the Huijgenspark in The Hague, more than a hundred starlings have fallen dead from the trees in recent days. It is a mystery what happened to the animals. The Dutch Food and Consumer Product Safety Authority (NVWA) is having a number of birds examined in the laboratory of Wageningen Bioveterinary Research. Parts of the park are blocked and dogs are no longer allowed to be let out. The dead birds are always cleaned up as quickly as possible. Yet it is a lugubrious scene. Council member Robert Barker of the Party for the Animals had the feeling of being on a ‘crime scene’. “The fact that so many birds fall from the sky at this location must have a cause and must be investigated. If there is talk of poisoning, then we have to take a hard time. ” It is also possible that the birds have a disease. “In any case, it’s going fast. The animals are not emaciated, do not seem ill. They just fall dead from the tree, “says employee Sharon Lexmond of bird shelter De Wulp. A possible link was established between 5G trials in Groningen and the ‘crazy cows there, as they were called, see: Stopumts.nl Further info from Facebook: Trondheim (3rd city of Norway) also attacked the birds. After 6 months there was no toxicological report yet. It has also happened in Sweden, Australia, United States. Nyhetsspeilet.no In the meantime (30-10-2018) received some more information. The birds that fell massively dead would be the victims of an experiment, performed on those days in The Hague, where RF radiation was tested with a peak frequency of 7.40 GHz, which corresponds to a wavelength of 4.05 cm. This wavelength is of the same order of magnitude as the size of the starlings. This may be important because of possible resonance effects. The mast in question is about 400 meters from where the starlings have fallen dead. This information comes from one source and should still be confirmed, if possible. Source 2: https://www.rtlnieuws.nl Mysterious bird deaths in The Hague: dead starlings fall massively from the sky Oct. 26, 2018 For several days in a row, dead starlings fall from the sky in the Huijgenspark in The Hague. It is estimated that around 150 birds have already lost their lives. What is the cause of this is being investigated? The Dutch Food and Consumer Product Safety Authority, the Dutch Wildlife Health Center and a Wageningen University laboratory are investigating the cause of death of the starlings. A veterinarian of bird care De Wulp performed a number of birds last week. She only found internal bleeding and no trace of poison. Contaminated water… ”Last year we had the same situation at the Haagse Hogeschool, where it was renovated at the time ”, says an employee of the Animal Ambulance.” Then dozens of dead jackdaws were found, which were probably poisoned because they had been drinking polluted water. What is going on right now is really speculating. Hopefully, we know more next week, because this is not normal. ” No trace of poison. Source 3: Dierenhospitaal and Dierenambulance The Hague Again, dead starlings have been found in the Huijgenspark in The Hague. More than ninety dead birds were spread across the park in the Stationsbuurt. We took the birds. Last time, five of the deceased starlings were examined by a local specialist. It did not show signs of poison, but only internal bleeding in two copies. The newly found starlings are examined by the specialized Wageningen Bioveterinary Research laboratory in Lelystad and the Dutch Wildlife Health Center in Utrecht. The municipality has promulgated a ban on dogs in the area because the cause of the mortality is unclear. Poisoning is taken into account. The area has been blocked by the police. Source 4: Birdcare the curlew Oct. 26, 2018 How is the current state of affairs with regard to the dead starlings? Last Friday, Wednesday and Thursday, a total of +/- 150 deceased starlings were found in the Huijgenspark in The Hague. OnSundayy, Thursday and Friday our veterinarian visited and carried out a total of 15 animals and collected material for further research. On Wednesday, the NVWA collected a cargo of birds that were examined in Lelystad on West Nile Virus. The negative result has now arrived. On Thursday, the Dutch Wildlife Health Center also picked up a load of birds and we got a result today. Both veterinarians (ours and those from the DWHC) discussed their findings with each other. (Birds in good condition, some small bleeding in some animals, good for the upcoming winter, empty stomachs.) It is a very strange story! Components of the deceased birds now go to various institutes for further research into rat poison and various viruses. On Monday the preparations are ready and the microscopic examination is started. In the meantime, the municipality has instituted an outlet ban in the park until further notice. We will keep you informed and hope that we will get a quick answer regarding the bizarre deaths. Source 5: New contribution from Facebook: Nov. 2, 2018 There is, of course, no certainty about the cause. There are stronger 4G and IoT channels in the vicinity near the park. In July there was also 5G tested, but then the birds did not swarm and they did not arrive in the park. IoT has also been active since 30 October 2017, so it is only briefly active with a safe distance (for humans) of 7.4 meters and with a 2000 Watt transmitter at less than 200 meters from the park main beam direction exactly across the park. Also at the same distance LTE channels and at another location also LTE stations etc. Here again exactly about the park. The truth about the safety of 5G is that it’s not safe. And while letters have been sent and people have raised the alarm, the “powers that be” don’t seem to care. All in the name of money and industry. Reference: Healthnutnews.com
