news_title	news_url	text
Tucker Carlson: Criminals would be protected from deportation under bill AOC and other House Democrats back	https://www.foxnews.com/opinion/tucker-carlson-criminals-would-be-protected-from-deportation-under-bill-aoc-and-other-house-democrats-back	At this moment there is a bill pending in Congress called the New Way Forward Act. It’s received almost no publicity, which is unfortunate as well as revealing. The legislation is sponsored by 44 House Democrats, including Reps. Ilhan Omar of Minnesota and Alexandria Ocasio-Cortez of New York. At roughly 4,400 words, it’s almost exactly as long as the U.S. Constitution. Like the Constitution, this legislation is designed to create a whole new country. The bill would entirely remake our immigration system, with the explicit purpose of ensuring that criminals are able to move here, and settle here permanently, with impunity. TUCKER CARLSON: TRUMP'S ACQUITTAL WAS AS PREDICTABLE AS 'TITANIC' - MAYBE NOW WE CAN HAVE OUR COUNTRY BACK You may think we’re exaggerating for effect. We’re not – not even a little. The New Way Forward act is the most radical single piece of legislation we’ve seen proposed in this country. It makes the Green New Deal look like the status quo. A document produced by Democrats to promote the bill says: “Convictions … should not lead to deportation.” Keep in mind, we’re not talking about convictions for double parking. The bill targets felony convictions – serious crimes that send you to prison for years. A press release from Rep., Jesus Garcia, D-Ill., is explicit about this. Garcia brags that the bill will break the “prison to deportation pipeline.” How does the bill do that? Under current U.S. law, legal U.S. immigrants can be deported if they commit an “aggravated felony” or a “crime of moral turpitude” – that is, a vile, depraved act, like molesting a child. Under the New Way Forward Act, “crimes of moral turpitude” are eliminated entirely as a justification for deportation. And the category of “aggravated felony” gets circumscribed too. What does that mean? Consider this: Under current law, immigrants who commit serious crimes – such as robbery, fraud, or child sexual abuse – must be deported, regardless of the sentence they receive. Other crimes – less severe ones like racketeering – require deportation as long as the perpetrator receives at least a one-year sentence. But if this bill passes the House and Senate and is signed into law by the president, there will no longer be any crimes that automatically require deportation. None. And one crime – falsifying a passport – will be made immune from deportation, no matter what. Because apparently 9/11 never happened, and we no longer care about fake government documents. If you just renewed your driver’s license to comply with the Real ID Act, you must feel like an idiot. Under the proposed legislation, the minimum prison sentence for crimes that still require deportation would rise from one year to five. We checked the Bureau of Justice Statistics. According to federal data, crimes like car theft, fraud, and weapons offenses all carry average prison sentences of fewer than five years. And that’s just looking at averages. There are people who commit rape, child abuse and even manslaughter and receive sentences of fewer than five years. Lots of them. If the New Way Forward Act becomes law, immigrants who commit those crimes and receive those sentences would remain in the country. They’ll all be eligible for citizenship one day, too. But even that is understating the law’s effect. Even a five-year prison sentence won’t necessarily be enough to secure deportation. The bill would grant sweeping new powers to immigration judges, allowing them to nullify a deportation order. The only requirement is that “the immigration judge finds such an exercise of discretion appropriate in pursuit of humanitarian purposes, to assure family unity, or when it is otherwise in the public interest.” In other words, anti-American immigration judges – and many of them are exactly that – would have a blank check to open the borders. No vote required. Sound shocking to you? We’re just getting started. Current U.S. law makes drug addiction grounds for deportation, because why wouldn’t it? This bill would eliminate that statute. Current law also states that those who have committed drug crimes abroad, or any “crimes involving moral turpitude,” are ineligible to immigrate here. The New Way Forward Act abolishes that statute. A Mexican drug cartel leader could be released from prison, then freely come to America immediately. And if he wants, he could come here illegally, and it wouldn’t be a crime – because, and you were waiting for this, the bill also decriminalizes illegal entry into America, even by those previously deported. According to a document promoting the bill, criminalizing illegal entry into America is “white supremacist.” By this point, you’re beginning to wonder if we’re making this up. We’re not. In fact, we’re barely halfway through the bill. The legislation doesn’t just make it harder to deport legal immigrants who commit crimes. It doesn’t just make it easier for criminals to legally move here. The bill would also effectively abolish all existing enforcement against illegal immigration. To detain illegal immigrants, Immigration and Customs Enforcement (ICE) would have to prove in court that the illegal immigrants are dangerous or a flight risk. But of course, ICE wouldn’t be allowed to use a detainee’s prior criminal behavior as proof he or she is dangerous. That's banned. ICE would have to overcome even more hurdles if the detainee claims to be gay or transgender, under 21, or can’t speak English and an interpreter isn’t immediately available. In other words, it would be much harder to arrest an illegal alien than it is to arrest you. They’re the protected class here. You’re just some loser who’s paying for it all. But believe it or not, we saved the nuttiest part for last. What could be more destructive than changing U.S. law, specifically to allow rapists, child molesters, and drug dealers to stay in America? How about this: Using taxpayer money to bring deported criminals back into America. That’s right. This bill would not only abolish your right to control who lives in your own country, but it invents a new right in return: the “right to come home.” The bill orders the government to create a “pathway for those previously deported to apply to return to their homes and families in the United States,” as long as they would have been eligible to stay under the new law. The Department of Homeland Security must spend taxpayer dollars transporting convicted criminal illegal aliens into the United States. Who will be eligible for these free flights? Tens of thousands of people kicked out of this country for all kinds of crimes. Sexual abuse. Robbery. Assault. Drug trafficking, weapons trafficking, human trafficking. From 2002 to 2018, 480,000 people were deported for illegal entry or reentry into America. And under this bill, you’d have to buy them all a plane ticket to come back. The tickets alone would cost about a billion dollars, and that’s before Democrats make you start paying for these criminals’ free health care, too. Which they plan to. CLICK HERE TO SIGN UP FOR OUR OPINION NEWSLETTER The New Way Forward Act fundamentally inverts every assumption you have about America. Under this legislation, the criminals are the victims. Law enforcement is illegitimate. It’s racist, just like the country you live in, and the only solution is to get rid of both. America would be better off as a borderless rest area for the world’s worst predators and parasites. This is a big deal. It’s hard to believe any American would put these ideas on paper, much less pass them into law. Yet, remarkably, the press has ignored it. Scores of Democrats have backed it, but the bill hasn’t been mentioned in The New York Times, or on CNN, or even in self-described conservative outlets like National Review. If a lone Republican state legislator from Minot, N.D., had proposed a bill this extreme, that would remake America this completely, the president himself would be expected to answer for it. CLICK HERE TO GET THE FOX NEWS APP CNN would demand the president “disavow,” even if he knew nothing about it. But when one-fifth of the Democratic caucus backs a bill demanding that you pay to import illegal alien felons, it’s a non-event in American media. They don’t think you should know about it. That’s dangerous. Whether the press cares or not, these are the stakes of the 2020 election. A growing wing of the Democratic Party views America as essentially illegitimate – a rogue state, in which everything must be destroyed and remade: our laws, our institutions, our freedoms, our history and our values. That’s the point of all this, of course. An entirely new country, in which resistance is crushed, and they’re in charge forever. Adapted from Tucker Carlson’s monologue on “Tucker Carlson Tonight” on Feb. 6, 2020. CLICK HERE FOR MORE FROM TUCKER CARLSON
Suitcase Full Of Dead Birds From China Intercepted At Virginia Airport	https://www.dailywire.com/news/suitcase-full-of-dead-birds-from-china-intercepted-at-virginia-airport	No matter what the reason, we should all be able to agree that sending a suitcase full of dead birds – from anywhere, to anywhere – is not right. The ordeal is made more disturbing by the fact that the suitcase was sent from China, which is currently dealing with the coronavirus and has struggled in the past with a bird flu epidemic. WTHR reported Monday that U.S. Customs and Border Protection (CBP) agents intercepted a package at Dulles International Airport in Virginia that was filled with small dead birds. “According to officials, the traveler arrived on a flight from Beijing, China on Jan. 27, 2020 where the traveler’s final destination was to a residence in Prince George’s County, Maryland,” the outlet reported. “During a baggage examination, CBP specialists discovered a package with pictures of a cat and dog that the passenger said was ‘cat food.’ The package, according to officials, contained a bunch of unknown small birds, about 2.5 to 3.5 inches in length.” CBP provided disturbing images of the pet-food packaging that does, in fact, contain dead birds. .@CBP agriculture specialists at Dulles airport continue to protect our nation’s vital agricultural resources and our economy by intercepting potential animal threats, like those posed by these tiny dead birds from China packaged as “pet food.” Read https://t.co/uJj5o5xfmN pic.twitter.com/xTldZ6G6jM — CBP Mid-Atlantic (@CBPMidAtlantic) February 10, 2020 As one can imagine, importing dead animals such as birds from China isn’t a good idea. “These dead birds are prohibited from importation to the United States as unprocessed birds pose a potentially significant disease threat to our nation’s poultry industries and more alarmingly to our citizens as potential vectors of avian influenza,” said Casey Durst, director of field operations for CBP’s Baltimore Field Office. “Customs and Border Protection agriculture specialists continue to exercise extraordinary vigilance every day in their fight to protect our nation’s agricultural and economic prosperity from invasive pests and animal diseases.” CBP published a press release about the find that included an additional quote from Durst. “Customs and Border Protection agriculture specialists protect our nation’s agricultural industries from a variety of potential threats every day, including from highly pathogenic animal diseases that threaten our nation’s economy,” Durst continued. “CBP agriculture specialists continue to exercise extraordinary vigilance in their fight to protect our nation’s agriculture and economic prosperity from invasive pests and animal diseases.” The press release also said the U.S. Fish and Wildlife Service, USDA’s Animal and Plant Health Inspection Service, and the Centers for Disease Control and Prevention (CDC) “regulate the importation of animals and animal products into the United States.” On any given day in 2019, CBP agriculture officials across the country likely “seized 4,695 prohibited plant, meat, animal byproduct, and soil, and intercepted 314 insect pests at U.S. ports of entry.” As of January 2020, the World Health Organization (WHO) reported that between 2003 and 2020, there were 861 cases of avian influenza reported around the world. An estimated 455 people died due to the virus. China is currently dealing with an epidemic of the coronavirus, which has killed hundreds, possibly thousands, of people in the communist nation already. The WHO suggested on Monday that the deaths so far “may be the tip of the iceberg.” It is so far estimated that more than 1,000 people have died from the virus while more than 40,000 were infected.
PLANE THAT DISAPPEARED IN BERMUDA TRIANGLE IN 1945 LANDS IN FLORIDA, CREW MEMBERS REMEMBER NOTHING	https://worldnewsdailyreport.com/plane-that-disappeared-in-bermuda-triangle-in-1945-lands-in-florida-crew-members-remember-nothing/	One of a group of five Grumman TBM Avenger torpedo bombers that disappeared over the Bermuda Triangle on December 5, 1945, mysteriously reappeared this morning at the Patrick Air Force Base in Brevard, Florida. Around 7:15 AM this morning, a single-engine propeller aircraft arrived in the vicinity of the United States Air Force restricted flight zone and used an abandoned military radio frequency to demand permission to land on the installation. The pilot ignored several warnings from the tower operators, insisting that his obsolete aircraft was a military vehicle belonging to the U.S. Air Force. The craft was finally escorted to the airfield by two F-14 jet fighters and landed on the airfield under close scrutiny. The base’s security staff was extremely surprised to see two disoriented old men wearing WW2 uniforms come out of the cockpit, visibly confused. According to U.S. Air Force spokesman, Colonel James Miller, the two men claimed to be have disappeared in 1945 and have no memory of what happened to them over the last 75 years. “They asked us if the war with Japan was over and who had won. These old guys seemed visibly confused.” Colonel Miller says the men’s fingerprints and teeth seem to match the military records of the men they claim to be, Lt. James Monroe and Captain David Smith Jr., but they seem to be much younger than they should. “They look around 65 years old when they should be over 110 years old. It’s as if they had gotten lost in a type of warp zone where time is slowed.” Both men will undergo a thorough medical examination and interrogation to try and determine the veracity of their story and what may have happened to them. The aircraft was authenticated as one of five planes part of Flight 19 which disappeared over the Bermuda Triangle in December 1945. Flight 19 was taking part in routine navigation and combat training exercises in TBM-type aircraft when they lost radio contact and disappeared. None of the planes were ever found, and another craft even disappeared while searching for them. Unfortunately, the two men seem to have no memory of what happened to them during their ordeal, so the mystery remains total concerning the faith of the other aircrafts.
A lost plane in 1945 reappeared after 75 years and the crew were asking if the World war 2 has ended	https://9jaupdate24x7.com/2020/02/13/a-lost-plane-in-1945-reappeared-after-75-years-and-the-crew-were-asking-if-the-world-war-2-has-ended/	The world of wonder, today, 13 / 02/2020 around 7:15 AM this morning, a single-engine propeller aircraft arrived in the vicinity of the United States Air Force restricted flight zone and used an abandoned military radio frequency to demand permission to land on the installation. The pilot ignored several warnings from the tower operators, insisting that his obsolete aircraft was a military vehicle belonging to the U.S. Air Force. The craft was finally escorted to the airfield by two F-14 jet fighters and landed on the airfield under close scrutiny. The base’s security staff was extremely surprised to see two disoriented old men wearing WW2 uniforms come out of the cockpit, visibly confused. According to U.S. Air Force spokesman, Colonel James Miller, the two men claimed to be have disappeared in 1945 and have no memory of what happened to them over the last 75 years. The soldiers asked the management of Airport if the war with Japan was over and who had won. These old guys seemed physically arranged. Colonel Miller was reported to have said that the men’s fingerprints and teeth seemed to match the military records of the men they claimef to be, Lt. James Monroe and Captain David Smith Jr., but they seemed to be much younger than they should. “They look around 65 years old when they should be over 110 years old. It’s as if they had gotten lost in a type of warp zone where time is slow.” Both men as Reported by Time news will now undergo a thorough medical examination and interrogation to try and determine the veracity of their story and what may have happened to them. Share this: Twitter Facebook 
Largest Planet-Killer Asteroid To Approach Earth This Month Arriving On Saturday	https://www.ibtimes.com/largest-planet-killer-asteroid-approach-earth-month-arriving-saturday-2921210	KEY POINTS NASA spots a planet-killer asteroid approaching Earth The approaching space rock is a potentially hazardous asteroid The asteroid is big enough to cause a major impact event A potentially hazardous asteroid that’s big enough to trigger a nuclear winter and mass extinction events on Earth following a collision will intersect the planet’s path this weekend. According to the data collected by NASA, the approaching asteroid is larger than the tallest man-made structure in the world. NASA’s Center for Near-Earth Object Studies (CNEOS) has identified the incoming asteroid as 163373 (2002 PZ39). As indicated in CNEOS’ database, this asteroid is currently traveling toward Earth at a speed of almost 34,000 miles per hour. CNEOS estimated that 163373 (2002 PZ39) has a diameter of around 3,250 feet, making it significantly bigger than the Burj Dubai, which is currently the tallest building in the world. Given its incredible size, 163373 (2002 PZ39) will be the biggest asteroid to approach Earth this month. According to CNEOS, 163373 (2002 PZ39) is an Apollo asteroid, which means it is known to intersect Earth’s path around the Sun from time to time. Due to its dangerous orbit and massive size, approaching space rock has been labeled as a potentially hazardous asteroid. “Potentially Hazardous Asteroids (PHAs) are currently defined based on parameters that measure the asteroid’s potential to make threatening close approaches to the Earth,” NASA explained in a statement. Since 163373 (2002 PZ39) follows an Earth-crossing orbit, it has a chance of colliding with Earth every time it passes the planet. If the asteroid collides with Earth, it will cause a major impact event. NASA and other space agencies have warned that kilometer-sized asteroids can do a lot of damage to Earth. If 163373 (2002 PZ39) hits the planet, its initial blast would instantly kill off millions. Then, due to its size, the energy from its explosion would be enough to trigger a global nuclear winter that could last for years. The harsh environmental changes triggered by the asteroid’s impact could lead to the mass extinction of different species. According to CNEOS, 163373 (2002 PZ39)’s near-Earth intersection will happen on Feb. 15 at 6:05 a.m. EST. During this time, the asteroid will pass over the planet from a distance of 0.03860 astronomical units or around 3.6 million miles away. Photo: Donald Davis
China seek for court’s approval to kill the over 20,000 coronavirus patients to avoid further spread of the virus	https://ab-tc.com/china-seek-for-courts-approval-to-kill-the-over-20000-coronavirus-patients-to-avoid-further-spread-of-the-virus/	
Mike Bloomberg Threatens Trump After Buying All His Debt	https://www.gishgallop.com/mike-bloomberg-threatens-trump-after-buying-all-his-debt/	New York, NY — In what many analysts are calling a brilliant political and financial maneuver, former New York City mayor, millionaire and now former Democrat presidential candidate Mike Bloomberg said he’d purchased all of Donald Trump’s debt for pennies on the dollar. “It’s always been in the plan to do this,” said Mr. Bloomberg speaking with a medium-sized crowd in Austin, Texas yesterday. “It’s all a part of our goal to rescue the country from Donald Trump. And it was inexpensive as you might imagine. Like everything else in Donald’s life, even his debt is worthless, and we got it for a song and a dance.” It’s what Bloomberg is doing or not doing with the debt that has rocked the political world. “There are several things Bloomberg could do with Trump’s debt,” said the University of Chicago’s Professor James Badwater of the James Badwater Institute of Public Policy and Veterinary Ethics. “What he’s probably going to do is is start collections proceedings against the President. This will allow him to see all of his tax returns and other sensitive financial records. Or he could threaten to do that, which will keep Trump off keel.” Mr. Bloomberg had no issue sharing the amount he paid for Trump’s debt. “He has a lot more than you think. More than we even thought,” continued Mr. Bloomberg to the Austin crowd. “Billions. But we were able to get all of it for just under 240 million [dollars]. Deutsche Bank was happy to unload over 1 billion at a 90% discount. And now that we have it, it gives us leverage against Donald. We’re already moving to put liens on several of his properties.” According to Bloomberg spokesperson Daft Houser, the former New York City may use this noose over Trump’s head to force his organization into distracting negotiations. “As Mike said, the liens are going in this week. And the Trump organization has already reached out to us. Mostly with lawsuit threats,” said Mr. Houser speaking from the Miami, Florida campaign headquarters. “Nobody has been able to reveal the criminal nature of Trump’s emoluments violations in such a quick and effective manner. They’re scared.” Critics say President Trump continues to violate the Constitution by retaining ownership and control of his sprawling business empire. They say this went against both long-standing historical practice and the advice of career government ethics officials and put him at odds with the Constitution’s original anti-corruption provisions the moment he was sworn in. The White House acknowledged that “an interest outside of Trump Enterprises has purchased negative equity financial products contained within the company’s portfolio,” but declined to say who it was, nor what impact that will have on the operations of the President’s properties. However, in what has become a habit by Eric Trump, the youngest Trump clumsily took to Twitter to express his frustration. “Bloomberg’s shekels can’t buy the Presidency from my Father, who only cares about America #KAG2020.” The Tweet has been since deleted. The Trump 2020 campaign has not responded to Bloomberg’s debt purchase but said Eric has been put on a “Twitter timeout.”
California Legislature Cancels President’s Day: ‘We Won’t Celebrate Trump’	https://tatersgonnatate.com/california-legislature-cancels-presidents-day-we-wont-celebrate-trump/	In an emergency session held illegally on a Sunday, which also happens to be Leonid Stalin’s birthday, the California legislature has voted to cancel President’s Day “until such time as respect has been restored to the White House.” Governor Galvin Newscomb signed the bill into law over lunch at Wahoo’s Fish Taco, where he was meeting with leaders from Mexico about opening more of the border to illegal immigrants. According to a press release from Newsconb’s office, the bill wasn’t very difficult to pass: “Today, the California legislature passed the first cancelation of a federal holiday in our nation’s history. After an overwhelming response from a public petition signed by more than 30 million Californians, the elected representatives of our state decided that there was no way we could hols any form of celebration of the Office of the President of the United States while a criminal occupies it. “The canceled holiday does not mean children would have to go to school or that state offices will be open. We will instead celebrate ‘Immigration Day,’ and offer all of the state’s undocumented workers a free meal and medical checkup with no questions asked.” The stunt is said to have a cost of nearly $6 billion, which is enough money to fund education in Mississippi for the next 400 years, but they just don’t care. This is what happens when you let communists run a state. They destroy it. More than a million Trump supporters and a guy who really likes Mike Pence are planning demonstrations at their local In N Out Burger. The chain has announced that red MAGA hats and misspelled signs won’t be welcome inside, but that people are welcome to make spectacles of themselves outside all they like. Counter-protests and groups of people in lawn chairs there to point and laugh are expected to show up as well. The White House hasn’t tweeted their response yet. We’ll keep you posted. Share this: 
