news_title	news_url	text
If Pot is Legalized in Illinois, What Happens to Medical Marijuana?	https://news.wttw.com/2019/05/23/if-pot-legalized-illinois-what-happens-medical-marijuana	UPDATE: Illinois Welcomes Weed, Waits on a Budget with Another Extended Session Anyone who figured it would be easy for Democrats to legalize marijuana, think again. Thanks to our sponsors: View all sponsors Attempts have stalled in New York and New Jersey. The effort is still alive in Illinois, but there’s only a week or so left before the legislative session is set to adjourn, and negotiations are ongoing. Where does that leave the state’s blossoming medical marijuana pilot program, which first took effect in 2014 and is set to expire next year? The program was intentionally restrictive – so much so that when pot dispensaries opened their doors in 2015, sales were slow. “I think there was a lot of people that didn’t that the program was even going on. I still a lot of people aren’t necessarily informed that it’s going on,” said Paul Lee, the general manager of Chicago’s first cannabis shop, Dispensary 33 in Andersonville. He says things picked up – especially after former Gov. Bruce Rauner last summer signed a law liberalizing the program. It allows doctors to effectively prescribe marijuana as an alternative to addicting opioids, it removed a requirement that potential patients be fingerprinted, and patients can register for provisional access rather than having to wait months for approval. Total retail sales since the program’s inception have now topped $323 million, and as of early May, more than 65,500 patients are certified to participate – nearly double the number of patients on the state’s registry at this time last year. Dispensary 33 is preparing for the day Illinois’ market opens up even more – to anyone 21 or older. Lee is hiring more employees, increasing training, even redecorating the store with custom cannabis wallpaper and art made of hand-stained sheets cut to the size of rolling paper. Cannabis cultivation centers, like Cresco Labs, are also expanding in preparation for legal weed. “Of course, we’re looking down the road at what it could be. So, this facility here in Joliet, you know, we’ve built out to our full capacity and we’re expanding other facilities around the state to be able to accommodate both the future patient growth and an adult-use program here in this state,” Cresco spokesman Jason Erkes said. “We want to be ready for when and if that happens, to be able to accommodate, you know, the patients, the consumers, and anybody that’s interested in buying cannabis products.” While lawmakers continue to debate what legal pot should look like in Illinois, it seems they have settled on this much: Even if it gets to the point that any adult could get legal weed, llinois will continue to have a medical marijuana program. “Why would we keep a medical program, if there’s a recreational source around and you could skip seeing the doctor and just go get it yourself? It’s that you’ll miss out on the monitoring with one’s other medications, for instance,” said Dr. Leslie Mendoza Temple, a physician in Glenview who chaired the state government’s now-disbanded Medical Marijuana Advisory Board. “We would want to be sure we’re monitoring for abuse, toxicity. And you wouldn’t have those checks in place if one were just using it without kind of any medical supervision, if you’re using it for medical purposes.” To be part of the official medical program, a physician needs to certify patients as having one of the 41 debilitating conditions, including AIDS, glaucoma, Parkinson’s or PTSD. Lawmakers are also set to consider adding more conditions and letting nurses (not just doctors) do the certification, under a plan sponsored by state Rep. Bob Morgan, D-Deerfield, that would also make the medical marijuana program permanent. Patients using pot as medicine have to apply, register with the state and pay the $100 annual fee for a card. It’s a somewhat rigorous process that requires completing a bunch of paperwork. But patients would get a benefit for their trouble: -The recreational cannabis legislation contemplates tax rates ranging from 10% to 25%, depending on THC levels. Compare that with the 1% sales tax on medical marijuana (the same sales tax for all pharmaceuticals). -The medical cannabis wouldn’t be subject to the same potency limits as recreational pot. -It’s likely that only medical marijuana patients will be permitted to grow weed at home. The initial proposal backed by Gov. J.B. Pritzker called for allowing anyone over 21 to be able to grow up to five cannabis plants at home. But a forthcoming revised version is expected to scale it back as part of a compromise with law enforcement. Sponsoring Sen. Heather Steans, D-Chicago, told WTTW News it’s an important option for those who use marijuana as medicine, given that insurance and Medicaid won’t pay for it because the drug is still illegal at the federal level. Steans says growing it at home could be a less-expensive option. But Temple is against recreational marijuana – she’s concerned about the message it sends to youth, and about potential abuses. She’s also concerned about what an expanded market will mean for her patients, who count on the drug to help them sleep, stem nausea or subdue pain. “I want to see my patients protected in getting the highest quality products with the high CBD, the low THC, which many of them want and benefit from, and what I don’t know is how the market is going to take over when recreational cannabis takes over. Because then price will become a driver,” she said. Even some initial skeptics admit they’ve warmed to Illinois’ strict rules governing the medical marijuana program. “We’ve ensured basically that each patient, when they come in and buy one of our products, they know exactly what they’re getting, they know that it hasn’t been treated with pesticides, they know that it’s good quality, and they know that it’s going to be consistent every time they get it,” said John Sullivan of Illinois Grown Medicine, a cultivation center in Elk Grove Village. Like Dispensary 33 and Cresco, Illinois Grown Medicine is growing operations in anticipation of Illinois making weed legal to anyone age 21 or older. Under the proposal lawmakers are set to consider, patients who want to continue buying medical marijuana would get dibs. “Dispensaries and cultivators will have to set aside products sufficient to meet the demands of patients,” said state Rep. Kelly Cassidy, D-Chicago, who is the House sponsor of the recreational cannabis bill. “We’re not going to let folks go without their relief.” Follow Amanda Vinicky on Twitter: @AmandaVinicky Related stories: Marijuana is a Psychoactive Drug. But is it Really a Medicine? The Growing Business of Cannabis in San Diego How the Legalization Debate is Playing Out Across the US High Time or Half-Baked? Illinois Looks to Legalize Weed Thanks to our sponsors: View all sponsors
FBI Special Agent David Raynor murdered with his own gun	https://archive.fo/QZkkr#selection-1489.0-1489.56	FBI Agent, Who Exposed Hillary Clinton's Cover-up, Found Dead FBI Special Agent David Raynor murdered with his own gun | @NeonNettle By: Jay Greenberg on 18th June 2018 @ 2.45pm © press Special Agent David Raynor was due to testify against Hillary Clinton when he died An FBI Special Agent, who was anticipated to expose the extent of Clinton and Obama malpractice and corruption in the "Operation Fast and Furious" cover-up before a US Federal Grand Jury, has been found dead at his home. The FBI official's wife was also found dead at the scene with the couple both being murdered using the 52-year-old agent's own gun. Raynor's tragic death comes just one day before he was due to testify before a US Federal Grand Jury He was widely expected to testify that Hillary Clinton acted illegally to protect Obama administration crimes while covering up the Fast and Furious scandal. © Facebook Special Agent David Raynor and his wife were both found dead Raynor’s wife, Donna Fisher, was also found dead at the scene. An autopsy will be completed to determine the exact cause of death, according to police. According to the Baltimore Sun Authorities, who are offering a $215,000 reward for tips in Suiter’s killing, have struggled to understand what happened. The detective was shot with his own gun, which was found at the scene. Two other shots were fired from the gun, and Davis said there were signs of a brief struggle. Special Agent Raynor’s suspicious death is the latest in a sequence of disturbing deaths in Baltimore connected to the Clinton/Obama cover-up of Operation Fast and Furious. When President Trump took power, the US Justice Department opened another investigation into Operation Fast and Furious as it pertained to the Baltimore Police Department and impaneled a US Federal Grand Jury. © Facebook Special Agent David Raynor was due to testify against Hillary Clinton One of the main witnesses was Detective Sean Suiter, an 18-year veteran of the FBI. However, Detective Suiter was gunned down in November, in eerily similar circumstances to Special Agent Raynor , also one day before he could testify. © press The couple was found murdered outside their home Special Agent Raynor was leading US Deputy Attorney General Rod Rosenstein’s and FBI Director Christopher Wray’s investigation into the murder of Detective Sean Suiter, who he believed was silenced before he could testify that the Obama administration was criminally complicit in allowing guns to flow into the hands of criminals on the Mexican border. © press The was was killed using Special Agent David Raynor's own gun These guns were involved in the murder of a US Federal Officer, among others, and is seen by investigators as the “Achilles heel of the Obama regime,” because the murder of Border Patrol Agent Brian Terry is one of but a very few Obama administration crimes that have no statute of limitations as it involved the killing of a US Federal Officer. Leaked Wikileaks emails also prove Hillary Clinton was fully knowledgeable about the crime —thus making her liable to criminal charges. © press Police close off the area around the couple's home where their bodies were found Last's week's bombshell Inspector General's reports have exposed yet more Hillary Clinton and Obama Administration crimes. The report, that was released last Thursday, revealed that the FBI had discovered evidence that Hillary Clinton and the Clinton Foundation had committed " sexual crimes against children ." The report also shows that Obama lied to cover-up parts of these investigations that exposed child trafficking. However, the IG report proves that the evidence of these crimes has been covered-up and swept under the carpet by those acting at the highest levels.
Was an FBI Agent Who Exposed Hillary Clinton’s Corruption Found Dead?	https://anticorruptiondigest.com/2018/07/25/was-an-fbi-agent-who-exposed-hillary-clintons-corruption-found-dead/#axzz5uapEVDmG	Was an FBI Agent Who Exposed Hillary Clinton’s Corruption Found Dead? On 18 June 2018, the disreputable website Neon Nettle reported that an FBI agent was murdered as part of a conspiracy to cover up the corruption of Hillary Clinton, who unsuccessfully ran for the presidency of the U.S. in 2016: But there’s no mystery surrounding how Raynor died — Anne Arundel County Police Lt. Ryan Frashure told us officers witnessed Raynor’s turning his gun on himself on 7 March 2018: Investigators believe Raynor stabbed his 54-year-old wife, Donna Fisher, to death near their home in Crownsville, Maryland, before killing himself. The couple had been in the midst of divorce proceedings and, Frashure said, were “having serious domestic issues.” The week they died they were in court fighting over custody of their 10-year-old daughter. According to investigators, no evidence suggests Raynor’s death was in any way connected to the Fast and Furious operation, an Obama-era “gunwalking” scandal. Moreover, “Fast and Furious” had nothing to do with Hillary Clinton’s State Department, as it involved the Phoenix division of the U.S. Bureau of Alcohol, Tobacco, Firearms and Explosives’ (ATF), an organization within the United States Department of Justice (DOJ). Neon Nettle’s sole documentation for their claim that Raynor died “just one day before he was due to testify before a US Federal Grand Jury” was a link to an eight-month-old news article about the shooting death of a Baltimore homicide detective, an article that made no mention of David Raynor, the FBI, Hillary Clinton, or “Fast and Furious.” (The slain detective was scheduled to testify before a federal grand jury, but that case was about Baltimore police accused of shaking down citizens and conspiring with drug dealers, not about the ATF and gunwalking in Arizona.) Source: FACT CHECK: Was an FBI Agent Who Exposed Hillary Clinton’s Corruption Found Dead? 
FBI Official, Who Exposed Clinton’s ‘Fast & Furious’ Cover Up, Found Dead	https://newspunch.com/fbi-clinton-fast-furious-dead/	
Army Welcomes First Openly Transgender Military Working Dogs	https://www.duffelblog.com/2014/12/army-military-working-dogs/	JOINT BASE LEWIS-McCHORD, Wash. — Meet Tracker, a five-year-old, sixty-pound Belgian Malinois and a graduate of the Military Working Dog School at Lackland Air Force Base, Texas. He’s also one of the Army’s first five openly transgender military police dogs, assigned to the 42nd Military Police Brigade at Joint Base Lewis-McChord. “We took to each other pretty quickly,” said Spc. Jeffrey Grassley, a military policeman and dog handler partnered with Tracker. “I mean, it’s a little weird that they tell me to call him a ‘him,’ since he’s obviously a female dog, and there was that time last month when he was laid up for a few days after he gave birth to a litter of puppies, but we’ve really forged a close working friendship.” Tracker, who was raised as a female dog under the name Regina, first identified as a male during the initial breeding and selection process the military uses to screen potential military working dogs. “Looking back now, it was pretty obvious that she was — sorry, He — was a little different,” said Tech Sgt. Walter Flaherty, one of Tracker’s trainers. “He didn’t really say much, obviously, but you could just sort of tell.” During play time, Flaherty said, Tracker would consistently engage in behavior normally associated with male dogs, and whenever he would go into heat, would go after the females pretty aggressively, almost totally ignoring the male dogs. “He would only play with blue chew toys, and for some reason, he really liked watching reruns of ‘Xena: Warrior Princess,'” Flaherty added. Paws Across The Rainbow, the nation’s leading advocacy group for LGBT animals, hailed the move, calling it a “landmark achievement for all military working animals, no matter what their sexuality.” “We hope that this will serve as an example throughout the military that being transgendered is simply not a reason to discriminate against competent and talented military working animals of all species, said spokesman Pat Riley, while also calling on the Army to provide no-cost gender-reassignment surgery for the dogs “as a gesture of tolerance and recognition of the diverse nature of today’s military working animals.” Some of the more traditional, conservative elements within the Army might not be so ready to embrace such a radical change, however. The all-male caisson horses of the 3rd Infantry Regiment, or “The Old Guard,” long entrusted with the solemn honor of bearing the caskets of fallen warriors and deceased U.S. presidents, have drawn fire for refusing to allow female or openly LGBT horses within its ranks, and the regiment’s command team is unapologetic about that fact. “As long as I’m here, that’s the way it’s going to stay,” said Command Sgt. Maj. Samuel J. Stoker, The Old Guard’s senior noncommissioned officer. “I’ll resign before I’ll see some fancy-prancing fairy-horsey bear my president down the National Mall.” Stoker may be the last of a dying breed, however. Polling data suggests that most service members are indifferent to the idea, with 15 percent of those polled say they would “definitely” or “very likely” be willing to work with an openly LGBT military working animal. In that regard, Tracker and his four compatriots are pioneers in more than one way: If all goes well, according to sources within Defense Secretary Chuck Hagel’s office, their service may open the door to full integration for all LGBT military working animals. As for Spc. Grassley, Tracker’s handler, he says he doesn’t concern himself with the larger political implications of Tracker’s assignment to the unit, and just treats him as his K-9 partner, nothing more. “Every once in a while he tries to hump my leg, which is kind of pointless since he doesn’t have a penis, but it’s just a male-dominance thing, and besides, it’s pretty funny.”
Treason? Ilhan Omar Gives Iran Military Advice, Suggests It Could Target Trump Hotels	https://pjmedia.com/trending/treason-ilhan-omar-gives-iran-military-advice-suggests-it-target-trump-hotels/	The inspiringly patriotic Rep. Ilhan Omar (D-Tehran, no, check that, I’m hearing she’s from Minnesota) tweeted Monday offering some unsolicited military advice to the Islamic Republic of Iran: “Trump needs to immediately divest from his businesses and comply with the emoluments clause. Iran could threaten Trump hotels *worldwide* and he could provoke war over the loss of revenue from skittish guests. His business interests should not be driving military decisions.” She also tweeted a video in which the late comedian George Carlin asserts that the U.S. is “not very good at anything” besides war. And so once again we have to ask the by-now-familiar question: Is Ilhan Omar a traitor who hates America? Omar’s warning that Trump’s “business interests should not be driving military decisions” makes no sense, because clearly the fact that Trump owns hotels that Iran could target didn’t stop him from going after Qasem Soleimani. But as far as Omar and her ideological allies are concerned, it doesn’t matter how much they have to twist their logic into pretzels to get Trump, as long as they make the president look bad. That imperative has now driven Omar even to give a military suggestion to a hostile foreign power. The mullahs and their henchmen haven’t said anything about targeting Trump hotels, so here is a United States congresswoman to give them a marvelous new idea about how they could murder Americans and others, and further menace the United States. The definition of treason is giving aid and comfort to the enemy. The leaders of the Islamic Republic of Iran order their people to chant “Death to America” in mosques every Friday, and repeatedly vow that they will ultimately destroy the United States of America and the state of Israel. They were doing this before Soleimani was killed, and they’re doing it now. How is giving them a suggestion about how they could target the United States, whether or not they have or would have thought of it themselves, not giving aid and comfort to the enemy, and hence treason? When she took the oath of office to become a member of the United States House of Representatives, she swore to “support and defend the Constitution of the United States against all enemies, foreign and domestic,” as well as to “bear true faith and allegiance to the same.” Inviting, out of a hysterical hostility to the president of the United States, a nation that regularly chants “Death to America” to strike American-owned businesses – is that supporting and defending the nation against foreign enemies? Omar might well split hairs and assert that she suggested no attack on the Constitution, which is what she specifically swore to defend, but clearly the oath uses “Constitution” as a metonymy for the nation as a whole. Abetting this impression is the fact that Omar on the same day demonstrated her hostility to the country that she has sworn to protect and defend. She tweeted the Carlin video with the comment: “It’s no laughing matter,” just so we’re clear that she didn’t mean any joke. She is seriously offering the claim that the country to which she has sworn allegiance and which she represents in its Legislative Branch is just a war-mongering blunderer that is not good at anything besides being militarily aggressive. Meanwhile, she invites the military aggression of one of America’s foremost enemies. If the Islamic Republic of Iran turns out to be not good at much of anything besides war against the United States, would Ilhan Omar have any problem with that? Despite all this and more, it is, of course, inconceivable that any treason charges will ever be brought against Ilhan Omar. Her hatred of America plays well among the American Leftists who share it, and the Democratic Party establishment would condemn any such charges as a partisan attack and the attacker as a racist right-wing white supremacist and enemy of all that is good. Meanwhile, the past week has given us abundant examples of how the Democrats hate Trump with such burning intensity that they are willing to lionize and mourn a man who was responsible for the deaths of at least 600 Americans, as well as for a great deal more terrorist activity. So what’s a little treason among America-hating friends? Robert Spencer is the director of Jihad Watch and a Shillman Fellow at the David Horowitz Freedom Center. He is author of 19 books, including the New York Times bestsellers The Politically Incorrect Guide to Islam (and the Crusades) and The Truth About Muhammad. His latest book is The Palestinian Delusion: The Catastrophic History of the Middle East Peace Process. Follow him on Twitter here. Like him on Facebook here.
